{"schema_version":"1.0.0","packet_type":"result","packet_id":"9c2d89ca-b650-4d71-b479-519ca90b4d97","trace_id":"ec3492a4-6056-43d6-ba1d-b4e74354dea8","parent_packet_id":"1acb16ee-14f4-4633-be2f-2c2e3b8b57d6","created_at":"2026-03-22T00:35:30Z","from_agent":"scribe","to_agent":"tower","status":"success","summary":"Curated the initial Tower session into operational memory and state. Bootstrap placeholders were replaced with the current objective, blocker, next best action, and an active task record centered on restoring Codex authentication so Tower can rerun the queued Scribe packet.","work_completed":["Updated L0 and L1 memory to reflect that the first meaningful Tower session occurred, delegation is blocked by `refresh_token_reused`, and the immediate objective is to restore auth and rerun Scribe.","Updated current operational status, open questions, and known risks to capture the failed delegation attempt, the queued Scribe packet, and the unresolved scope of the imported `auth` goal.","Created active-task tracking in both `.control-tower/docs/tasks/active.md` and `.control-tower/state/task-ledger.json` for the bootstrap-curation follow-up."],"artifacts_changed":[".control-tower/memory/l0.md",".control-tower/memory/l1.md",".control-tower/docs/state/current-status.md",".control-tower/docs/state/open-questions.md",".control-tower/docs/state/known-risks.md",".control-tower/docs/tasks/active.md",".control-tower/state/task-ledger.json"],"artifacts_created":[],"artifacts_deleted":[],"findings":[{"severity":"warning","message":"Tower delegation remains blocked until Codex authentication is restored; the observed failure was `refresh_token_reused` during `tower-run delegate`."},{"severity":"warning","message":"The imported user goal `auth` is present in memory, but repo state does not establish its intended product scope."},{"severity":"info","message":"The queued Scribe packet at `.control-tower/packets/outbox/scribe-initial-session-state.json` is now the explicit next handoff once authentication is fixed."}],"follow_up_recommendations":["Re-authenticate Codex in this environment before attempting any further delegation.","Rerun `tower-run delegate scribe --packet .control-tower/packets/outbox/scribe-initial-session-state.json` or the repo's equivalent queued-packet flow once auth is restored.","Run `tower-run sync-memory` after the successful Scribe rerun so L0/L1 and imported session state stay aligned.","Clarify what the imported user goal `auth` refers to before seeding Builder or Scout work."],"review_requested":true,"doc_update_needed":false,"memory_worthy":["First meaningful Tower session resumed project control but could not delegate because Codex auth refresh failed with `refresh_token_reused`.","Operational next action is to restore auth, rerun the queued Scribe packet, then sync memory.","Imported user goal `auth` is known but still ambiguous in scope."],"metrics":{"tokens_used":0,"files_touched":7,"tests_added":0,"tests_passed":0},"raw_output_ref":null,"metadata":{}}