{"schema_version":"1.0.0","packet_type":"result","packet_id":"6b9ca9d3-cf69-4f0f-96c8-44e23874e4d3","trace_id":"4bbc8e26-d301-4334-a982-a96aa814da45","parent_packet_id":"d38da250-b1dc-4461-9d43-0dc08b42da90","created_at":"2026-03-31T06:00:00Z","from_agent":"inspector","to_agent":"tower","status":"success","summary":"Approved. I found no correctness, regression, or coverage issues in the updated changes to src/control_tower/backends.py and tests/test_bootstrap.py. The prior Cursor exec/test mismatch is resolved, the missing-stdout case is now handled safely, and the reviewed branch is merge-ready.","work_completed":["Reviewed the current diff in src/control_tower/backends.py and tests/test_bootstrap.py with focus on correctness and regressions.","Verified the Cursor exec path now matches the expected CLI invocation shape used by the tests.","Verified the Cursor exec implementation now tolerates subprocess.CompletedProcess(stdout=None) without raising before returning success.","Ran targeted backend tests with PYTHONPATH=src: tests.test_bootstrap.BackendTests.test_cursor_exec_builds_correct_args and tests.test_bootstrap.BackendTests.test_cursor_exec_tolerates_missing_stdout.","Ran the full backend-focused unittest class with PYTHONPATH=src: tests.test_bootstrap.BackendTests."],"artifacts_changed":[],"artifacts_created":[],"artifacts_deleted":[],"findings":[{"severity":"info","message":"No blocking findings. In src/control_tower/backends.py, _cursor_exec now normalizes stdout via `result.stdout or \"\"` before checking or writing it, which fixes the previous success-path crash risk when Cursor returns `stdout=None`."},{"severity":"info","message":"The test expectation mismatch is resolved in tests/test_bootstrap.py: the Cursor exec test now asserts the current `agent -p --output-format json` command shape instead of the old `cursor --headless` invocation."},{"severity":"info","message":"Verification passed with PYTHONPATH=src: the two targeted Cursor tests passed, and the full BackendTests suite passed (11/11)."}],"follow_up_recommendations":[],"review_requested":false,"doc_update_needed":false,"memory_worthy":[],"metrics":{"tokens_used":0,"files_touched":2,"tests_added":0,"tests_passed":11},"raw_output_ref":null,"metadata":{}}