{"schema_version":"1.0.0","packet_type":"result","packet_id":"9DD3A86A-A3CF-4F6E-96BD-62600F9A264B","trace_id":"380cbe3e-f4de-4917-9c46-b5a4ce0c18c4","parent_packet_id":"44f1a884-404c-4446-8470-b1b962afdf79","created_at":"2026-03-31T05:46:16Z","from_agent":"git-master","to_agent":"tower","status":"success","summary":"Committed the Cursor backend fix on claude/tender-darwin as 78b38e296b32f0a187879ab17cc2fa1bcaba7256 and pushed it to origin. Only src/control_tower/backends.py and tests/test_bootstrap.py were included; unrelated runtime drift, out.json, and src/control_tower.egg-info remain uncommitted.","work_completed":["Verified the worktree branch and inspected repo status.","Reviewed the intended diffs in src/control_tower/backends.py and tests/test_bootstrap.py.","Staged only the two requested files.","Created commit 78b38e296b32f0a187879ab17cc2fa1bcaba7256 with message 'Fix cursor backend stdout handling'.","Pushed claude/tender-darwin to origin without rewriting history.","Collected residual workspace dirt after push."],"artifacts_changed":["src/control_tower/backends.py","tests/test_bootstrap.py"],"artifacts_created":[],"artifacts_deleted":[],"findings":[{"severity":"info","message":"Push succeeded: origin/claude/tender-darwin advanced from 8dbd79906ba190e21c999b3329a2c84fa26d1fde to 78b38e296b32f0a187879ab17cc2fa1bcaba7256."},{"severity":"warning","message":"A first commit attempt hit a transient worktree index.lock error; retry succeeded without manual cleanup."},{"severity":"warning","message":"Targeted pytest execution could not run in the current environment because the installed pytest import path is broken (ImportError involving collections.MutableMapping/UserDict)."},{"severity":"info","message":"Residual modified files left uncommitted: .control-tower/logs/black-box.jsonl, .control-tower/memory/l0.md, .control-tower/memory/l1.md, .control-tower/state/decision-graph/edges.json, .control-tower/state/decision-graph/events.jsonl, .control-tower/state/decision-graph/indexes.json, .control-tower/state/decision-graph/nodes.json, .control-tower/state/project.json, .control-tower/state/runtime.json, .control-tower/state/session-index.json."},{"severity":"info","message":"Residual untracked files left uncommitted: .control-tower/memory/l2/sessions/019d4268-e6bc-77d0-a196-bfc387deb533.jsonl, .control-tower/memory/l2/sessions/019d426b-c63e-7dc2-a857-fdab83c57b43.jsonl, .control-tower/memory/l2/transcripts/019d4268-e6bc-77d0-a196-bfc387deb533.md, .control-tower/memory/l2/transcripts/019d426b-c63e-7dc2-a857-fdab83c57b43.md, .control-tower/packets/outbox/scribe-docs-followup-builder-20260331T054400Z.json, .control-tower/packets/outbox/scribe-docs-followup-inspector-20260331T054522Z.json, out.json, src/control_tower.egg-info/."}],"follow_up_recommendations":["Repair or isolate the local pytest environment before relying on local test verification for follow-up changes.","Clean or ignore the listed runtime drift artifacts separately if a clean worktree is needed for subsequent repo operations."],"review_requested":true,"doc_update_needed":false,"memory_worthy":["Commit 78b38e296b32f0a187879ab17cc2fa1bcaba7256 updates PR 17 branch claude/tender-darwin with the Cursor stdout handling fix and associated bootstrap test coverage."],"metrics":{"tokens_used":1800,"files_touched":2,"tests_added":1,"tests_passed":0},"raw_output_ref":null,"metadata":{}}