{"schema_version":"1.0.0","packet_type":"result","packet_id":"01e91bc6-a760-499d-8316-c3f1f17a8ecc","trace_id":"3cc89142-4765-4802-b873-a4eca9ec99dc","parent_packet_id":"d6d0b7d7-74c9-462b-9813-0c70961a21e2","created_at":"2026-03-22T00:54:35Z","from_agent":"git-master","to_agent":"tower","status":"success","summary":"Staged the remaining `.control-tower/` operational artifacts, created follow-up commit `93cdca07b6cf480f3ff17da9694103640b051ed3` (`chore: capture rollout operational artifacts`), and pushed `main` to `origin`. Final branch state is `main...origin/main` with no residual modified or untracked files.","work_completed":["Reviewed pending repository state on `main` and confirmed only Control Tower operational artifacts were outstanding.","Staged all remaining `.control-tower/` rollout artifacts, including state docs, memory files, logs, L2 session/transcript records, outbox packets, and decision-graph updates.","Created local follow-up commit `93cdca07b6cf480f3ff17da9694103640b051ed3` with commit message `chore: capture rollout operational artifacts`.","Pushed `main` to `origin` without force and verified the branch is synchronized with the remote.","Verified the working tree is clean after push and that no residual untracked files remain."],"artifacts_changed":[".control-tower/docs/state/current-status.md",".control-tower/docs/state/decisions.md",".control-tower/docs/state/known-risks.md",".control-tower/docs/state/open-questions.md",".control-tower/docs/tasks/active.md",".control-tower/memory/l0.md",".control-tower/memory/l1.md",".control-tower/state/decision-graph/edges.json",".control-tower/state/decision-graph/indexes.json",".control-tower/state/decision-graph/nodes.json",".control-tower/state/runtime.json",".control-tower/state/session-index.json",".control-tower/state/task-ledger.json"],"artifacts_created":[".control-tower/logs/black-box.jsonl",".control-tower/memory/l2/sessions/019d12f0-115b-7a20-a4a0-3a8210a841ee.jsonl",".control-tower/memory/l2/sessions/019d12f0-c5b7-7d33-804a-413e708b33c4.jsonl",".control-tower/memory/l2/sessions/019d12f1-c4b6-74a2-a3d1-2d2a71ed3eb8.jsonl",".control-tower/memory/l2/sessions/019d12f2-6cf3-7631-b544-c55013580eaa.jsonl",".control-tower/memory/l2/sessions/019d12f3-8a99-7cd2-bb62-c86bd0a3c266.jsonl",".control-tower/memory/l2/sessions/019d12f5-adad-7251-8ea6-37c328be4636.jsonl",".control-tower/memory/l2/sessions/019d12f6-f51b-7da2-882d-f58e7321b7c1.jsonl",".control-tower/memory/l2/sessions/019d12f8-098a-7663-983d-3955a8b2f3d1.jsonl",".control-tower/memory/l2/transcripts/019d12f0-115b-7a20-a4a0-3a8210a841ee.md",".control-tower/memory/l2/transcripts/019d12f0-c5b7-7d33-804a-413e708b33c4.md",".control-tower/memory/l2/transcripts/019d12f1-c4b6-74a2-a3d1-2d2a71ed3eb8.md",".control-tower/memory/l2/transcripts/019d12f2-6cf3-7631-b544-c55013580eaa.md",".control-tower/memory/l2/transcripts/019d12f3-8a99-7cd2-bb62-c86bd0a3c266.md",".control-tower/memory/l2/transcripts/019d12f5-adad-7251-8ea6-37c328be4636.md",".control-tower/memory/l2/transcripts/019d12f6-f51b-7da2-882d-f58e7321b7c1.md",".control-tower/memory/l2/transcripts/019d12f8-098a-7663-983d-3955a8b2f3d1.md",".control-tower/packets/outbox/git-master-checkin-rollout.json",".control-tower/packets/outbox/git-master-checkin-rollout.result.json",".control-tower/packets/outbox/git-master-push-all-rollout-artifacts.json",".control-tower/packets/outbox/scout-rollout-conventions.json",".control-tower/packets/outbox/scout-rollout-conventions.result.json",".control-tower/packets/outbox/scribe-docs-followup-git-master-20260322T003716Z.json",".control-tower/packets/outbox/scribe-finalize-rollout-state.json",".control-tower/packets/outbox/scribe-finalize-rollout-state.result.json",".control-tower/packets/outbox/scribe-initial-session-state.json",".control-tower/packets/outbox/scribe-initial-session-state.result.json",".control-tower/packets/outbox/scribe-memory-sync-20260322T003039Z.json",".control-tower/packets/outbox/scribe-memory-sync-20260322T003039Z.result.json",".control-tower/state/decision-graph/events.jsonl"],"artifacts_deleted":[],"findings":[{"severity":"info","message":"New local commit created: `93cdca07b6cf480f3ff17da9694103640b051ed3` (`chore: capture rollout operational artifacts`)."},{"severity":"info","message":"Push completed successfully: `origin/main` advanced from `055b116` to `93cdca0`."},{"severity":"info","message":"Final repository state is clean: `main...origin/main` with no residual modified or untracked files."}],"follow_up_recommendations":[],"review_requested":true,"doc_update_needed":false,"memory_worthy":["Commit `93cdca07b6cf480f3ff17da9694103640b051ed3` captures the remaining Control Tower rollout operational artifacts.","`main` has been pushed to `origin` and is now synchronized with the remote at `93cdca07b6cf480f3ff17da9694103640b051ed3`."],"metrics":{"tokens_used":0,"files_touched":43,"tests_added":0,"tests_passed":0},"raw_output_ref":null,"metadata":{}}