{"schema_version":"1.0.0","packet_type":"result","packet_id":"9171049e-0688-4314-a057-c3e2f33d5291","trace_id":"2396294f-839e-4b8f-a47d-30d0206f80f5","parent_packet_id":"0559413a-288e-41ae-bbee-9ef6577f0ab1","created_at":"2026-03-22T00:39:54Z","from_agent":"scribe","to_agent":"tower","status":"success","summary":"Reconciled Control Tower operational docs and memory to the current post-auth state. Stale auth-blocker messaging was removed from active status, tasks, memory, and decisions; the rollout is now recorded as locally committed via `8d9033f06b4ff4a72589972220ddf87832fa7a78`, with remaining follow-up limited to transient artifact review, next Git handling, convention codification, and the still-ambiguous imported `auth` goal.","work_completed":["Updated `.control-tower/docs/state/current-status.md`, `.control-tower/docs/state/open-questions.md`, and `.control-tower/docs/state/known-risks.md` to reflect successful auth recovery, completed Scribe and Scout curation, the local rollout commit, and the remaining post-check-in follow-up.","Replaced the stale active task with a new post-check-in follow-up task in `.control-tower/docs/tasks/active.md` and `.control-tower/state/task-ledger.json`, while marking the earlier auth-recovery and rollout-check-in work complete.","Updated `.control-tower/memory/l0.md` and `.control-tower/memory/l1.md` so working memory now reflects the local rollout commit, current conventions, remaining risks, and the narrowed open-question set.","Rewrote `.control-tower/docs/state/decisions.md` so active decisions capture the rollout conventions and local commit state, and the old auth-blocked rollout narrative is explicitly superseded."],"artifacts_changed":[".control-tower/docs/state/current-status.md",".control-tower/docs/state/open-questions.md",".control-tower/docs/state/known-risks.md",".control-tower/docs/tasks/active.md",".control-tower/state/task-ledger.json",".control-tower/memory/l0.md",".control-tower/memory/l1.md",".control-tower/docs/state/decisions.md"],"artifacts_created":[],"artifacts_deleted":[],"findings":[{"severity":"info","message":"Operational state now records the Control Tower rollout bootstrap as committed locally on `main` via `8d9033f06b4ff4a72589972220ddf87832fa7a78` (`chore: add Control Tower rollout bootstrap`)."},{"severity":"warning","message":"The repository still has untracked transient `.control-tower` artifacts after the local rollout commit, so push or PR handling should be decided only after reviewing that transient set."},{"severity":"warning","message":"Git-master and Builder conventions are now explicit in operational state, but they are not yet codified in the agent prompt or policy files."},{"severity":"warning","message":"The imported user goal `auth` remains unresolved in repo context and stays as the only open operational question."}],"follow_up_recommendations":["Review the remaining untracked transient `.control-tower` artifacts before deciding whether to push or open a PR from commit `8d9033f06b4ff4a72589972220ddf87832fa7a78`.","Codify the Git-master branch-and-PR convention and the Builder avoid-path convention in agent guidance so the documented state matches execution policy.","Clarify the repo-specific meaning of the imported `auth` goal before routing additional scoped work from it."],"review_requested":true,"doc_update_needed":false,"memory_worthy":["Control Tower rollout bootstrap is no longer auth-blocked and is recorded as a local commit on `main` at `8d9033f06b4ff4a72589972220ddf87832fa7a78`.","Operational state now treats Git-master branch-and-PR flow, Builder avoidance of live `.control-tower/` state, and `docs/` as the durable canonical docs store as active rollout guidance.","Remaining follow-up is limited to transient artifact review, next Git handling for the local commit, convention codification in agent guidance, and clarifying the imported `auth` goal."],"metrics":{"tokens_used":0,"files_touched":8,"tests_added":0,"tests_passed":0},"raw_output_ref":null,"metadata":{}}