{"schema_version":"1.0.0","packet_type":"result","packet_id":"1623fa84-c9a6-4fc8-a268-ec3a151a9515","trace_id":"717159b8-14b6-4b18-bbb1-cd954125645d","parent_packet_id":"09f92dc8-2796-4097-b923-e0cd3f12e5cd","created_at":"2026-03-22T00:33:09Z","from_agent":"scribe","to_agent":"tower","status":"success","summary":"Curated working memory to reflect the imported Tower session’s durable signal: initial Scribe curation was queued, specialist delegation is currently blocked by Codex auth (`refresh_token_reused`), and the next operational step is to restore auth, rerun the queued Scribe packet, then run `tower-run sync-memory`. Existing docs/state files already captured the active task, open question about the imported `auth` goal, and the delegation risk; I aligned L0/L1 and the active-task summary with that state.","work_completed":["Reviewed the imported L2 session and transcript for the durable outcome from the prior Tower session.","Verified task state in `.control-tower/state/task-ledger.json` and used it as the source for human-readable state alignment.","Updated L0 memory to replace the bootstrap placeholder with the current blocker and next action.","Updated L1 working memory with the latest imported session reference, delegation blocker, queued packet, and next action.","Normalized `.control-tower/docs/tasks/active.md` into flat task bullets consistent with the task ledger."],"artifacts_changed":[".control-tower/memory/l0.md",".control-tower/memory/l1.md",".control-tower/docs/tasks/active.md"],"artifacts_created":[],"artifacts_deleted":[],"findings":[{"severity":"warning","message":"Tower still cannot delegate to specialist agents until Codex authentication is restored; the observed failure in imported memory is `refresh_token_reused` during auth refresh."},{"severity":"warning","message":"The imported user goal `auth` is present in working memory, but its intended product/repo scope is still not grounded in repo docs or the imported logs."},{"severity":"info","message":"`.control-tower/docs/state/current-status.md`, `.control-tower/docs/state/open-questions.md`, `.control-tower/docs/state/known-risks.md`, and `.control-tower/state/task-ledger.json` were already aligned with the imported blocker and active task, so no further edits were required there."}],"follow_up_recommendations":["Restore Codex authentication in this environment before attempting further Tower delegation.","Rerun `.control-tower/packets/outbox/scribe-initial-session-state.json` once auth is restored so the initial bootstrap-curation packet produces a specialist ResultPacket.","Run `tower-run sync-memory` after the queued Scribe packet completes to refresh L1/L0 from the updated operational state.","Clarify what the imported user goal `auth` refers to before assigning Builder or Scout work tied to that goal."],"review_requested":false,"doc_update_needed":true,"memory_worthy":["Initial Tower bootstrap curation is not complete yet; the queued Scribe packet exists but delegation previously failed before a ResultPacket was produced.","The active operational task is `tower-session-bootstrap-curation`, focused on restoring delegation and replacing bootstrap placeholders with curated state.","The current blocker is Codex auth refresh failure (`refresh_token_reused`), which prevents Tower from delegating to Scribe, Builder, Scout, Inspector, and Git-master.","The next best action remains: re-authenticate, rerun the queued Scribe packet, then run `tower-run sync-memory`.","The imported user goal `auth` remains ambiguous and should stay open until grounded in repo state or future logs."],"metrics":{"tokens_used":0,"files_touched":3,"tests_added":0,"tests_passed":0},"raw_output_ref":null,"metadata":{}}