{"schema_version":"1.0.0","packet_type":"result","packet_id":"b4e0d5af-958e-4fc2-a449-0cf25f24c068","trace_id":"8151eb27-adbe-4a02-8f0a-23445632d6c3","parent_packet_id":"51df52f2-fb91-4ef5-bc8a-0c3c33d63a69","created_at":"2026-03-30T22:43:55Z","from_agent":"builder","to_agent":"tower","status":"success","summary":"Fixed the Cursor exec crash on successful runs with null stdout and aligned the backend test contract to the actual headless Cursor agent invocation. Focused backend tests and the broader bootstrap test module now pass in the PR worktree.","work_completed":["Updated `src/control_tower/backends.py` so `_cursor_exec()` normalizes `result.stdout` to an empty string before checking or writing it, preventing crashes when subprocess returns `stdout=None`.","Updated `tests/test_bootstrap.py` to assert the actual Cursor headless contract used by the implementation: `agent -p --output-format json`.","Added a regression test covering successful Cursor exec results with `stdout=None`, verifying no crash and no output file write.","Ran focused backend tests first with `PYTHONPATH=src python3 -m unittest tests.test_bootstrap.BackendTests` and then the broader suite with `PYTHONPATH=src python3 -m unittest tests.test_bootstrap`."],"artifacts_changed":["src/control_tower/backends.py","tests/test_bootstrap.py"],"artifacts_created":[],"artifacts_deleted":[],"findings":[{"severity":"info","message":"Focused backend suite passed: 11 tests in `tests.test_bootstrap.BackendTests`."},{"severity":"info","message":"Broader bootstrap/backend coverage passed: 75 tests in `tests.test_bootstrap`."},{"severity":"info","message":"`python3 -m pytest ...` was not usable in this worktree because `pytest` is not installed, so verification used the repository's `unittest` module instead."}],"follow_up_recommendations":["Proceed to review on PR 17; the Cursor-specific blockers in this task packet are resolved."],"review_requested":true,"doc_update_needed":false,"memory_worthy":[],"metrics":{"tokens_used":0,"files_touched":2,"tests_added":1,"tests_passed":75},"raw_output_ref":null,"metadata":{}}