{"schema_version":"1.0.0","packet_type":"result","packet_id":"e3f8d9d8-519a-4d3f-b9f3-17ba6d5d9271","trace_id":"255a8394-ee8e-4a41-b674-a25315808d03","parent_packet_id":"74bb340a-7924-4d97-a5a6-a38776a5a86e","created_at":"2026-03-22T00:45:00Z","from_agent":"scout","to_agent":"tower","status":"success","summary":"Repo state supports three concrete rollout conventions. Git-master should assume a branch-and-PR workflow off `main`, not direct commits on `main`; Builder should default to product-code surfaces (`src/`, `tests/`) and avoid repo docs and live `.control-tower/` operational state unless a packet explicitly targets bootstrap/runtime plumbing; Scribe should treat `docs/` as canonical durable documentation, `.control-tower/docs/state` as canonical only for Tower operational status/tasks/open questions, and `.control-tower/memory` as derived non-canonical memory. Main rollout risk is that the bootstrap is still uncurated and uncommitted on `main` while the queued Scribe handoff remains blocked by Codex auth failure.","work_completed":["Inspected the repo docs harness in `AGENTS.md` and `docs/index.md` plus the design and product doc indices.","Reviewed Tower, Builder, Git-master, Scribe, and Scout prompts and policy files under `.control-tower/agents/`.","Checked current operational state under `.control-tower/docs/state/` and repo Git status/history to ground workflow recommendations in current project usage."],"artifacts_changed":[],"artifacts_created":[],"artifacts_deleted":[],"findings":[{"severity":"info","message":"Git workflow recommendation: use `main` as the protected integration branch and have Git-master create or use short-lived topic branches for Tower work, then prepare a PR or merge-ready diff back into `main`. Evidence: the current branch is `main` tracking `origin/main`, the bootstrap files are untracked on `main`, and recent history shows feature branches such as `codex/*`, `copilot/*`, and `claude/*` being merged via pull requests (`Merge pull request #7`, `#10`, `#11`)."},{"severity":"info","message":"Builder avoid-path recommendation: Builder should default to editing only `src/` and `tests/`, and should avoid `docs/`, `.control-tower/docs/`, `.control-tower/memory/`, `.control-tower/state/`, and packet/log artifacts unless a packet explicitly assigns Tower-runtime or bootstrap-template work. Evidence: the docs harness says durable knowledge lives in `docs/`; Scribe owns docs and memory consistency; `.control-tower/` currently contains operational state, logs, packets, and imported memory; Builder’s current policy broadly allows `.control-tower/`, which is too wide for normal feature work in this repo."},{"severity":"info","message":"Scribe canonical-doc recommendation: treat `docs/` as the canonical durable docs store for product/system knowledge, using `docs/index.md` plus `docs/design-docs/index.md` and `docs/product-specs/index.md` as the top-level entry points; treat `.control-tower/docs/state/*` and `.control-tower/docs/tasks/*` as canonical only for Tower’s live operational state; treat `.control-tower/memory/*` as supporting memory that may inform docs but does not override them. This matches both the repo docs harness and the Scribe prompt."},{"severity":"warning","message":"Rollout risk: the bootstrap guidance is not fully curated yet. `.control-tower/docs/state/open-questions.md` still contains the three standing questions plus an unresolved imported goal `auth`, and `.control-tower/docs/state/current-status.md` says bootstrap placeholders remain because the Scribe delegation failed with `refresh_token_reused`."},{"severity":"warning","message":"Rollout risk: committing the current untracked `.control-tower/` tree as-is may freeze transient artifacts into version control, including packet outbox files, imported session transcripts under `.control-tower/memory/l2/`, and task state that still describes an auth incident rather than settled operating guidance. These files are operationally useful, but some are session-specific rather than durable policy."},{"severity":"warning","message":"Policy gap: Builder policy currently lists `.control-tower/` as an allowed path without narrowing operational subpaths. If Tower relies only on that policy, Builder could legitimately edit live memory/state files that Scribe and Tower prompts say should be curated separately."},{"severity":"warning","message":"Policy gap: Git-master prompt defines responsibilities and restrictions, but does not yet encode the observed branch/PR convention. Without that explicit guidance, Tower could route Git-master to commit directly on `main`, which would be inconsistent with the repo’s recent workflow and risk mixing bootstrap rollout with unrelated local state."}],"follow_up_recommendations":["Update Git-master operating guidance to assume: branch from `main`, keep `main` clean, stage only intended files, and prepare PR-ready output unless a packet explicitly authorizes a direct local commit.","Narrow Builder default scope in prompt or policy to `src/` and `tests/`, with `.control-tower/` edits allowed only for explicit bootstrap/runtime-template tasks such as changes under `src/control_tower/templates/` or runtime code in `src/control_tower/`.","Document the Scribe split explicitly: `docs/` for durable canonical knowledge, `.control-tower/docs/state` for live Tower status/task bookkeeping, `.control-tower/memory` for derived memory only.","Before checking in the bootstrap, restore Codex auth, rerun the queued Scribe packet, and replace or prune transient packet/session artifacts so committed Tower files reflect policy rather than one failed session."],"review_requested":true,"doc_update_needed":true,"memory_worthy":["This repo already signals a branch-and-PR workflow on top of `main` through multiple `codex/*`, `copilot/*`, and `claude/*` branches merged back to `main`.","For this repo, Builder should avoid live `.control-tower/` operational state by default; Scribe owns docs/memory curation and `docs/` is the durable source of truth.","Bootstrap rollout is currently blocked on Codex auth recovery and pending Scribe curation, so untracked `.control-tower/` contents should not be treated as final operating guidance yet."],"metrics":{"tokens_used":0,"files_touched":15,"tests_added":0,"tests_passed":0},"raw_output_ref":null,"metadata":{}}