{"schema_version":"1.0.0","packet_type":"result","packet_id":"41772cb2-ae4c-4c31-bd85-456625ba6a50","trace_id":"33e0f624-f99a-484a-84ca-c40c24dab4bf","parent_packet_id":"2bd4e3b3-6776-434b-8a51-b338cc64fe82","created_at":"2026-03-30T23:10:00Z","from_agent":"builder","to_agent":"tower","status":"success","summary":"Updated the init UI Codex model shortlist to the requested five-model lineup and added focused tests that lock both the curated list and the picker display order.","work_completed":["Replaced the legacy Codex model shortlist in src/control_tower/config_ui.py with gpt-5.4, gpt-5.4-mini, gpt-5.3-codex, gpt-5.2-codex, and gpt-5.2 in the requested order.","Added focused tests in tests/test_bootstrap.py to verify the Codex shortlist contents and the picker display order.","Verified the change with targeted unittest coverage using the local src tree via PYTHONPATH=src."],"artifacts_changed":["src/control_tower/config_ui.py","tests/test_bootstrap.py"],"artifacts_created":[],"artifacts_deleted":[],"findings":[{"severity":"info","message":"Verification passed with: PYTHONPATH=src python3 -m unittest tests.test_bootstrap.BackendTests.test_codex_model_picker_defaults_match_curated_order tests.test_bootstrap.BackendTests.test_codex_model_picker_displays_curated_defaults_in_order tests.test_bootstrap.BackendTests.test_valid_backends tests.test_bootstrap.BootstrapTests.test_interactive_config_can_disable_agent tests.test_bootstrap.BootstrapTests.test_custom_config_can_set_sandboxed_builder tests.test_bootstrap.CustomAgentTests.test_interactive_custom_agent_creation"},{"severity":"info","message":"pytest was not available in the active Python environment, so verification used unittest instead."}],"follow_up_recommendations":[],"review_requested":true,"doc_update_needed":false,"memory_worthy":[],"metrics":{"tokens_used":0,"files_touched":2,"tests_added":2,"tests_passed":6},"raw_output_ref":null,"metadata":{}}