{"schema_version":"1.0.0","packet_type":"result","packet_id":"782c0c94-eb0b-4857-827b-9d2cba114102","trace_id":"4256d614-ae07-4dc1-8c71-09bbad773aba","parent_packet_id":"e0827733-9e3e-4da6-9013-9005bc9ca13c","created_at":"2026-03-31T05:54:27Z","from_agent":"git-master","to_agent":"tower","status":"success","summary":"Local `main` was fast-forwarded from `61c7d55` to `77c1440` to match `origin/main`. Transient `.control-tower` operational artifacts were temporarily stashed with `git stash push -u`, restored with `git stash pop --index`, and remain uncommitted in the working tree.","work_completed":["Inspected `main` worktree status and identified modified and untracked transient `.control-tower` operational artifacts.","Fetched `origin/main` and confirmed local `main` was behind by 10 commits.","Temporarily stashed `.control-tower` tracked and untracked operational artifacts for pull hygiene.","Fast-forwarded local `main` to `origin/main` with `git pull --ff-only origin main`.","Restored the transient `.control-tower` artifacts after the sync and verified `main` is now up to date with `origin/main`."],"artifacts_changed":[".git/refs/heads/main",".git/FETCH_HEAD"],"artifacts_created":[],"artifacts_deleted":[],"findings":[{"severity":"info","message":"Pulled commit range: `92e8f69`, `3ebd054`, `a201363`, `1f5d524`, `129939b`, `e12ed7d`, `953b599`, `8dbd799`, `78b38e2`, ending at merge commit `77c1440`."},{"severity":"info","message":"Temporary stash used: `git-master sync main transient control-tower artifacts`; it was successfully dropped after `git stash pop --index` restored the local operational files."},{"severity":"warning","message":"The working tree still contains uncommitted transient `.control-tower` changes and packet artifacts by design, including modified memory/state files and untracked outbox/session files."}],"follow_up_recommendations":["Leave the current `.control-tower` working tree changes uncommitted unless a separate operational task explicitly needs them versioned.","If a clean working tree is needed for later repository operations, repeat the same stash-and-restore pattern scoped to `.control-tower/`."],"review_requested":true,"doc_update_needed":false,"memory_worthy":["Local `main` now matches `origin/main` at `77c1440` after PR #17 merge.","Transient `.control-tower` operational artifacts required a temporary stash during sync and were restored afterward without being committed."],"metrics":{"tokens_used":0,"files_touched":0,"tests_added":0,"tests_passed":0},"raw_output_ref":null,"metadata":{}}