{"schema_version":"1.0.0","packet_type":"result","packet_id":"8f8a47ef-948d-42ef-94dc-a023c97f1ff5","trace_id":"fc82f8b1-f29f-4261-bf6b-78cec28b023c","parent_packet_id":"661c46b8-c47e-4011-a6f9-a7481bbf83f2","created_at":"2026-03-22T00:46:30Z","from_agent":"git-master","to_agent":"tower","status":"success","summary":"Created local commit `8d9033f06b4ff4a72589972220ddf87832fa7a78` on `main` with message `chore: add Control Tower rollout bootstrap`. The commit stages the durable Control Tower bootstrap, docs harness, schemas, agents, curated operational docs, and current structured state, and stops before any push.","work_completed":["Reviewed the untracked Control Tower tree and separated durable bootstrap/runtime artifacts from transient operational byproducts for diff hygiene.","Staged 46 rollout files covering `AGENTS.md`, `docs/`, `.control-tower/agents/`, `.control-tower/docs/`, `.control-tower/memory/l0.md`, `.control-tower/memory/l1.md`, `.control-tower/memory/l2/README.md`, `.control-tower/packets/*/README.md`, `.control-tower/schemas/`, and selected `.control-tower/state/` JSON files.","Created the local commit `8d9033f06b4ff4a72589972220ddf87832fa7a78` with message `chore: add Control Tower rollout bootstrap` and verified that no push occurred."],"artifacts_changed":[],"artifacts_created":["AGENTS.md","docs/index.md","docs/design-docs/index.md","docs/product-specs/index.md","docs/runbooks/README.md",".control-tower/agents/"," .control-tower/docs/"," .control-tower/memory/l0.md"," .control-tower/memory/l1.md"," .control-tower/memory/l2/README.md"," .control-tower/packets/inbox/README.md"," .control-tower/packets/outbox/README.md"," .control-tower/schemas/"," .control-tower/state/agent-registry.json"," .control-tower/state/decision-graph/edges.json"," .control-tower/state/decision-graph/indexes.json"," .control-tower/state/decision-graph/nodes.json"," .control-tower/state/project.json"," .control-tower/state/runtime.json"," .control-tower/state/session-index.json"," .control-tower/state/task-ledger.json"],"artifacts_deleted":[],"findings":[{"severity":"info","message":"Commit created locally only: `8d9033f06b4ff4a72589972220ddf87832fa7a78` (`chore: add Control Tower rollout bootstrap`)."},{"severity":"info","message":"Included scope summary: Control Tower agent prompts/policies, docs harness indices, Control Tower operational docs/tasks, L0/L1 working memory plus L2 README, packet/schema definitions, and current structured runtime/state JSON needed to bootstrap the repository-local Control Tower setup."},{"severity":"warning","message":"Excluded transient artifacts for diff hygiene: `.control-tower/logs/black-box.jsonl`; `.control-tower/memory/l2/sessions/`; `.control-tower/memory/l2/transcripts/`; `.control-tower/packets/outbox/git-master-checkin-rollout.json`; `.control-tower/packets/outbox/scout-rollout-conventions.json`; `.control-tower/packets/outbox/scout-rollout-conventions.result.json`; `.control-tower/packets/outbox/scribe-finalize-rollout-state.json`; `.control-tower/packets/outbox/scribe-initial-session-state.json`; `.control-tower/packets/outbox/scribe-initial-session-state.result.json`; `.control-tower/packets/outbox/scribe-memory-sync-20260322T003039Z.json`; `.control-tower/packets/outbox/scribe-memory-sync-20260322T003039Z.result.json`; `.control-tower/state/decision-graph/events.jsonl`. These are session-specific, append-only, or task-ephemeral artifacts rather than stable rollout bootstrap files."},{"severity":"warning","message":"Residual risk: the committed operational state still records the unresolved `auth` goal ambiguity and prior auth-blocker narrative, so the bootstrap is checked in as a current snapshot rather than fully settled operating guidance."},{"severity":"warning","message":"Residual risk: the local working tree remains dirty because the excluded transient files are still untracked after the commit."}],"follow_up_recommendations":["Decide whether to add ignore rules or a cleanup routine for `.control-tower/logs/`, `.control-tower/memory/l2/`, packet outbox artifacts, and `.control-tower/state/decision-graph/events.jsonl` so future diffs stay clean.","If the rollout should reflect finalized operational guidance, run the pending Scribe curation flow and follow up with a second commit that updates the state docs and any accepted conventions.","Push or open a PR only after reviewing the remaining untracked transient artifacts and confirming the branch strategy for this repository."],"review_requested":true,"doc_update_needed":false,"memory_worthy":["Control Tower rollout bootstrap was committed locally on `main` as `8d9033f06b4ff4a72589972220ddf87832fa7a78` with message `chore: add Control Tower rollout bootstrap`.","Transient `.control-tower` logs, L2 session/transcript caches, packet outbox task/result files, and decision-graph event log were intentionally left untracked for diff hygiene.","No push occurred; the repository still has untracked transient Control Tower artifacts after the commit."],"metrics":{"tokens_used":0,"files_touched":46,"tests_added":0,"tests_passed":0},"raw_output_ref":null,"metadata":{}}